{
  "sequence": 1,
  "occurred_at_unix_ms": 1724000000000,
  "organization_id": "org",
  "project_id": "project",
  "run_id": "run-sample",
  "kind": "request_accepted",
  "payload": {
    "request_id": "req-sample"
  },
  "previous_hash": "0000000000000000000000000000000000000000000000000000000000000000",
  "event_hash": "aaaaaaaaaaaaaaaaaaaaaaaaaaaaaaaaaaaaaaaaaaaaaaaaaaaaaaaaaaaaaaaa"
}